{
  "schema_version": 1,
  "issue": 2,
  "run_id": "fixture-rate-limit",
  "provider": "codex",
  "status": "rate_limited_transient",
  "attempts": 3,
  "started_at": "2026-08-21T00:00:00.000Z",
  "finished_at": "2026-08-21T00:01:00.000Z",
  "retry_after": null,
  "exit_code": 1,
  "summary": "Synthetic rate limit fixture."
}
